{
  "schema_version": "1.0",
  "mission_name": "perimeter patrol x2 at 15m",
  "vehicle": "drone",
  "frame": "LOCAL_ENU_METERS",
  "cruise_speed_mps": 5.0,
  "commands": [
    { "type": "TAKEOFF", "alt": 15.0 },
    { "type": "LOOP", "count": 2, "waypoints": [
      { "x": 20.0, "y": 20.0, "alt": 15.0 },
      { "x": 20.0, "y": -20.0, "alt": 15.0 },
      { "x": -20.0, "y": -20.0, "alt": 15.0 },
      { "x": -20.0, "y": 20.0, "alt": 15.0 }
    ]},
    { "type": "RTL" }
  ]
}
